[
    {
        "question": "What was the percentage decline in ONGC's crude oil production in Q1 of FY2024-25?",
        "answer": "1.4 percent",
        "context": "Oil and Natural Gas Corporation reported a decline of 1.4 percent in its total crude oil production in the first quarter of the financial year 202425 the company said in a press release on August 5."
    },
    {
        "question": "How many million metric tonnes of crude oil did ONGC produce in Q1 of FY2024-25?",
        "answer": "5.237 MMT",
        "context": "ONGC s total crude oil production came in at 5.237 million metric tonnes (MMT) compared to 5.311 MMT last year."
    },
    {
        "question": "What was the percentage decline in ONGC's gas production in Q1 of FY2024-25?",
        "answer": "4.1 percent",
        "context": "The company s total gas production in Q1 declined 4.1 percent at 5.008 BCM compared to 5.221 BCM last year."
    },
    {
        "question": "How many BCM of gas did ONGC produce in Q1 of FY2024-25?",
        "answer": "5.008 BCM",
        "context": "The company s total gas production in Q1 declined 4.1 percent at 5.008 BCM compared to 5.221 BCM last year."
    },
    {
        "question": "Despite what government initiative did ONGC's oil and gas production decline in Q1 of FY2024-25?",
        "answer": "Government's push for increasing domestic and gas production in the country to reduce reliance on imports for energy needs",
        "context": "The decline in oil and gas production comes despite the government s push for increasing domestic and gas production in the country to reduce reliance on imports for energy needs."
    },
    {
        "question": "What percentage of its crude oil requirement does India currently import?",
        "answer": "87 percent",
        "context": "India currently imports around 87 percent of its crude oil and almost 50 percent of its gas requirement."
    },
    {
        "question": "What percentage decline did ONGC's consolidated net profit see in Q1 of FY2024-25 compared to the same period last year?",
        "answer": "42.8 percent",
        "context": "In Q1 ONGC posted a decline of 42.8 percent in consolidated net profit at Rs 10236 crore as compared to Rs 17893 crore in the same period a year ago."
    },
    {
        "question": "How much revenue from operations did ONGC report in Q1 of FY2024-25?",
        "answer": "Rs 1.66 lakh crore",
        "context": "The stateowned oil and gas exploration major reported 1.7 percent increase in revenue from operations for the quarter amounting to Rs 1.66 lakh crore compared to Rs 1.63 lakh crore recorded in the same period of the previous year."
    },
    {
        "question": "What was the consolidated net profit of Oil and Natural Gas Corporation (ONGC) in the first quarter of the financial year 2024-25?",
        "answer": "Rs 10,236 crore",
        "context": "Oil and Natural Gas Corporation (ONGC) posted a decline of 42.8 percent in consolidated net profit at Rs 10236 crore in the first quarter of the financial year 202425."
    },
    {
        "question": "How much was ONGC's consolidated net profit in the same period a year ago?",
        "answer": "Rs 17,893 crore",
        "context": "Oil and Natural Gas Corporation (ONGC) posted a decline of 42.8 percent in consolidated net profit at Rs 10236 crore in the first quarter of the financial year 202425 as compared to Rs 17893 crore in the same period a year ago."
    },
    {
        "question": "What was the sequential change in ONGC's consolidated net profit in the quarter ended June 30?",
        "answer": "11 percent decrease",
        "context": "Sequentially ONGC s consolidated net profit fell 11 percent in the quarter ended June 30 from Rs 11526.53 crore in the March quarter."
    },
    {
        "question": "What was ONGC's revenue from operations for the quarter?",
        "answer": "Rs 1.66 lakh crore",
        "context": "The stateowned oil and gas exploration major reported 1.7 percent increase in revenue from operations for the quarter amounting to Rs 1.66 lakh crore compared to Rs 1.63 lakh crore recorded in the same period of the previous year."
    },
    {
        "question": "What was ONGC's EBITDA for Q1?",
        "answer": "Rs 18,617.5 crore",
        "context": "ONGC s earnings before interest tax depreciation and amortisation (EBITDA) for Q1 rose to Rs 18617.5 crore."
    },
    {
        "question": "What was the crude oil price realization from ONGC's nominated fields for Q1?",
        "answer": "$83.05 per barrel",
        "context": "Crude oil price realization from ONGC s nominated fields was  83.05 per barrel for Q1 compared to  76.36 per barrel for the same period last year."
    },
    {
        "question": "What was the change in ONGC's crude oil production in Q1 compared to last year?",
        "answer": "1.4 percent decrease",
        "context": "In the first quarter the company s total crude oil production declined 1.4 percent from last year at 5.237 million metric tonnes (MMT)."
    },
    {
        "question": "What was the change in ONGC's gas production in Q1 compared to last year?",
        "answer": "4.1 percent decrease",
        "context": "ONGC s total gas production in Q1 declined 4.1 percent at 5.008 BCM from last year the company said in a press release."
    },
    {
        "question": "How many discoveries has ONGC declared in FY25 so far?",
        "answer": "5",
        "context": "The company said it has declared total five discoveries in FY25 so far."
    },
    {
        "question": "What was the closing price of ONGC's shares on August 5?",
        "answer": "Rs 310.15 apiece",
        "context": "On August 5 ONGC s shares closed 6.06 percent lower at Rs 310.15 apiece."
    },
    {
        "question": "What is ONGC focusing on in Tripura due to rapid urbanization?",
        "answer": "ONGC is focusing on cluster drilling to extract gas by using old wells in Tripura due to rapid urbanization.",
        "context": "Due to rapid urbanisation in Tripura ONGC is focusing on cluster drilling to extract gas by using old wells because facilities are already available there. Also we don t need to get fresh approval from the state for gas exploration or extraction in those sites. There is also no need to acquire land which has become a costly affair he said."
    },
    {
        "question": "How many rigs are currently being used by ONGC to explore natural gas in the northeastern state?",
        "answer": "At present, six rigs are being used by ONGC to explore natural gas in the northeastern state.",
        "context": "At present six rigs are being used by ONGC to explore natural gas in the northeastern state."
    },
    {
        "question": "What is the target set by ONGC for gas extraction in the current fiscal?",
        "answer": "ONGC has set a target of extracting 1675 MMSCM of gas during the current fiscal year (202425).",
        "context": "We have already set a target of extracting 1675 MMSCM of gas during the current fiscal year (202425) while the production was 1527 MMSCM in 202324 ONGC s Tripura Asset Manager Krishna Kumar told PTI."
    },
    {
        "question": "What is the issue faced by ONGC if one of the units of the Palatana power plant shuts down?",
        "answer": "If one of the units of the Palatana power plant in the state shuts down for any reason, the gas supply becomes surplus, causing loss to ONGC.",
        "context": "Emphasising the issue of proper utilisation of gas Kumar said if one of the units of the Palatana power plant in the state shuts down for any reason the gas supply becomes surplus causing loss to ONGC."
    },
    {
        "question": "What is the volume of gas produced by ONGC in Tripura in the 2023-24 fiscal?",
        "answer": "ONGC produced 1527 million standard cubic meters (MMSCM) of gas in Tripura in the 2023-24 fiscal.",
        "context": "ONGC produced 1527 million standard cubic metres (MMSCM) of gas in Tripura in the 202324 fiscal while it has set a target of extracting 1675 MMSCM gas in the current fiscal."
    },
    {
        "question": "What is ONGC doing to boost the exploration drive in Tripura?",
        "answer": "ONGC will dig as many as 20 new wells for gas exploration in the financial year 2024-25 and one more rig will be added shortly to boost the exploration drive.",
        "context": "He said that ONGC will dig as many as 20 new wells for gas exploration in the financial year 202425 and one more rig will be added shortly to boost the exploration drive."
    },
    {
        "question": "What is the reason behind the reduction in gas supply to various gas-based power generation plants in Tripura?",
        "answer": "The reason behind the reduction in gas supply to various gas-based power generation plants in Tripura is not mentioned in the given context.",
        "context": "The decision comes amid reports of a reduction in gas supply to various gasbased power generation plants in the state."
    },
    {
        "question": "Which government agencies operate the gas-based power plants in Tripura?",
        "answer": "The names of the government agencies that operate the gas-based power plants in Tripura are not mentioned in the given context.",
        "context": "Various staterun agencies operate the gasbased power plants in Tripura."
    },
    {
        "question": "What percentage of shares did OVL acquire in the BTC pipeline?",
        "answer": "0.737%",
        "context": "The agreement also includes acquiring 0.737 per cent shares of the Baku Tbilisi Ceyhan (BTC) pipeline company through its whollyowned subsidiary ONGC BTC Limited  it added."
    },
    {
        "question": "Who is the operator of the ACG field?",
        "answer": "BP",
        "context": "BP is the operator of the field with a 30.37 per cent stake. The remaining stake in the field is divided between Japanese firms and ExxonMobil. ACG is a supergiant offshore oil field in the Caspian Sea operated by oil major BP since 1999."
    },
    {
        "question": "In what year was the ACG contract extended to 2049?",
        "answer": "2017",
        "context": "ACG contract extension till 2049 was signed between field partners and SOCAR in September 2017."
    },
    {
        "question": "What is the total investment for the acquisitions?",
        "answer": "Up to USD 60 million",
        "context": "The acquisitions expected to be completed in the upcoming months involve a total investment of up to USD 60 million."
    },
    {
        "question": "In which countries does OVL have a stake in oil and gas projects?",
        "answer": "15 countries, including Vietnam and Venezuela",
        "context": "OVL holds a stake in 32 oil and gas projects in 15 countries ranging from Vietnam to Venezuela."
    },
    {
        "question": "What is SOCAR's original stake in BTC?",
        "answer": "25.0%",
        "context": "SOCAR already held a 25.0 per cent stake in ACG a 25.0 per cent stake in BTC via Azerbaijan BTC Limited and 50 per cent in Karabakh."
    },
    {
        "question": "When was the Azeri Central East production platform commissioned?",
        "answer": "Early 2024",
        "context": "The field has been developed in phases and a seventh production platform Azeri Central East has been commissioned in early 2024  the statement said."
    },
    {
        "question": "Where is the Sangachal terminal located?",
        "answer": "On the shores of the Caspian Sea",
        "context": "It links the Sangachal terminal on the shores of the Caspian Sea to the Ceyhan marine terminal on the Turkish Mediterranean coast."
    },
    {
        "question": "Why are shares of Oil and Natural Gas Corp trading higher?",
        "answer": "Shares of Oil and Natural Gas Corp are trading higher after Reuters reported citing industry source that India's largest oil and gas exploration company has sought a waiver from the U.S. Office of Foreign Assets Control to lift crude oil from Venezuela.",
        "context": "Shares of Oil and Natural Gas Corp are trading higher after Reuters reported citing industry source that India s largest oil and gas exploration company has sought a waiver from the U.S. Office of Foreign Assets Control to lift crude oil from Venezuela.The report said ONGC is optimistic of winning an approval according to a source who declining to be named.Earlier this year US had reimposed sanctions on Venezuela citing that the country had broken an accord to hold free and fair elections.India and even American oil refiners had increased imports of Venezuelan oil in 2023 after a sixmonth waiver from sanctions was announced which ended in April this year. Oil from Venezuela was among the cheapest for India s oil refiners with average landed cost reported at  60.60 a barrel in January this year.The Reuters report added that ONGC has been hopeful of recovering  500 million worth of dividends pending since 2014 for the stake it holds in Venezuelan projects. ONGC has instead sought oil instead of the pending dividend however there has not been much progress on that front so far.Crude oil has rallied this year helped by supply cuts by OPEC  though a volatility has declined to multiyear lows in June."
    },
    {
        "question": "What is ONGC's outlook on winning approval from the U.S. Office of Foreign Assets Control?",
        "answer": "ONGC is optimistic of winning an approval according to a source who declining to be named.",
        "context": "Shares of Oil and Natural Gas Corp are trading higher after Reuters reported citing industry source that India s largest oil and gas exploration company has sought a waiver from the U.S. Office of Foreign Assets Control to lift crude oil from Venezuela.The report said ONGC is optimistic of winning an approval according to a source who declining to be named.Earlier this year US had reimposed sanctions on Venezuela citing that the country had broken an accord to hold free and fair elections.India and even American oil refiners had increased imports of Venezuelan oil in 2023 after a sixmonth waiver from sanctions was announced which ended in April this year. Oil from Venezuela was among the cheapest for India s oil refiners with average landed cost reported at  60.60 a barrel in January this year.The Reuters report added that ONGC has been hopeful of recovering  500 million worth of dividends pending since 2014 for the stake it holds in Venezuelan projects. ONGC has instead sought oil instead of the pending dividend however there has not been much progress on that front so far.Crude oil has rallied this year helped by supply cuts by OPEC  though a volatility has declined to multiyear lows in June."
    },
    {
        "question": "Why did the U.S. reimpose sanctions on Venezuela?",
        "answer": "The U.S. reimposed sanctions on Venezuela citing that the country had broken an accord to hold free and fair elections.",
        "context": "Shares of Oil and Natural Gas Corp are trading higher after Reuters reported citing industry source that India s largest oil and gas exploration company has sought a waiver from the U.S. Office of Foreign Assets Control to lift crude oil from Venezuela.The report said ONGC is optimistic of winning an approval according to a source who declining to be named.Earlier this year US had reimposed sanctions on Venezuela citing that the country had broken an accord to hold free and fair elections.India and even American oil refiners had increased imports of Venezuelan oil in 2023 after a sixmonth waiver from sanctions was announced which ended in April this year. Oil from Venezuela was among the cheapest for India s oil refiners with average landed cost reported at  60.60 a barrel in January this year.The Reuters report added that ONGC has been hopeful of recovering  500 million worth of dividends pending since 2014 for the stake it holds in Venezuelan projects. ONGC has instead sought oil instead of the pending dividend however there has not been much progress on that front so far.Crude oil has rallied this year helped by supply cuts by OPEC  though a volatility has declined to multiyear lows in June."
    },
    {
        "question": "How much did ONGC pay for Venezuelan oil in January of this year?",
        "answer": "ONGC paid an average of $60.60 per barrel for Venezuelan oil in January of this year.",
        "context": "Shares of Oil and Natural Gas Corp are trading higher after Reuters reported citing industry source that India s largest oil and gas exploration company has sought a waiver from the U.S. Office of Foreign Assets Control to lift crude oil from Venezuela.The report said ONGC is optimistic of winning an approval according to a source who declining to be named.Earlier this year US had reimposed sanctions on Venezuela citing that the country had broken an accord to hold free and fair elections.India and even American oil refiners had increased imports of Venezuelan oil in 2023 after a sixmonth waiver from sanctions was announced which ended in April this year. Oil from Venezuela was among the cheapest for India s oil refiners with average landed cost reported at  60.60 a barrel in January this year.The Reuters report added that ONGC has been hopeful of recovering  500 million worth of dividends pending since 2014 for the stake it holds in Venezuelan projects. ONGC has instead sought oil instead of the pending dividend however there has not been much progress on that front so far.Crude oil has rallied this year helped by supply cuts by OPEC  though a volatility has declined to multiyear lows in June."
    },
    {
        "question": "What is ONGC hoping to recover from its stake in Venezuelan projects?",
        "answer": "ONGC is hoping to recover $500 million worth of dividends pending since 2014 for its stake in Venezuelan projects.",
        "context": "Shares of Oil and Natural Gas Corp are trading higher after Reuters reported citing industry source that India s largest oil and gas exploration company has sought a waiver from the U.S. Office of Foreign Assets Control to lift crude oil from Venezuela.The report said ONGC is optimistic of winning an approval according to a source who declining to be named.Earlier this year US had reimposed sanctions on Venezuela citing that the country had broken an accord to hold free and fair elections.India and even American oil refiners had increased imports of Venezuelan oil in 2023 after a sixmonth waiver from sanctions was announced which ended in April this year. Oil from Venezuela was among the cheapest for India s oil refiners with average landed cost reported at  60.60 a barrel in January this year.The Reuters report added that ONGC has been hopeful of recovering  500 million worth of dividends pending since 2014 for the stake it holds in Venezuelan projects. ONGC has instead sought oil instead of the pending dividend however there has not been much progress on that front so far.Crude oil has rallied this year helped by supply cuts by OPEC  though a volatility has declined to multiyear lows in June."
    },
    {
        "question": "Has ONGC made any progress in recovering the pending dividend from its stake in Venezuelan projects?",
        "answer": "There has not been much progress on that front so far.",
        "context": "Shares of Oil and Natural Gas Corp are trading higher after Reuters reported citing industry source that India s largest oil and gas exploration company has sought a waiver from the U.S. Office of Foreign Assets Control to lift crude oil from Venezuela.The report said ONGC is optimistic of winning an approval according to a source who declining to be named.Earlier this year US had reimposed sanctions on Venezuela citing that the country had broken an accord to hold free and fair elections.India and even American oil refiners had increased imports of Venezuelan oil in 2023 after a sixmonth waiver from sanctions was announced which ended in April this year. Oil from Venezuela was among the cheapest for India s oil refiners with average landed cost reported at  60.60 a barrel in January this year.The Reuters report added that ONGC has been hopeful of recovering  500 million worth of dividends pending since 2014 for the stake it holds in Venezuelan projects. ONGC has instead sought oil instead of the pending dividend however there has not been much progress on that front so far.Crude oil has rallied this year helped by supply cuts by OPEC  though a volatility has declined to multiyear lows in June."
    },
    {
        "question": "What has helped crude oil prices rally this year?",
        "answer": "Crude oil prices have rallied this year helped by supply cuts by OPEC.",
        "context": "Shares of Oil and Natural Gas Corp are trading higher after Reuters reported citing industry source that India s largest oil and gas exploration company has sought a waiver from the U.S. Office of Foreign Assets Control to lift crude oil from Venezuela.The report said ONGC is optimistic of winning an approval according to a source who declining to be named.Earlier this year US had reimposed sanctions on Venezuela citing that the country had broken an accord to hold free and fair elections.India and even American oil refiners had increased imports of Venezuelan oil in 2023 after a sixmonth waiver from sanctions was announced which ended in April this year. Oil from Venezuela was among the cheapest for India s"
    },
    {
        "question": "What is ONGC's goal for carbon emissions by 2038?",
        "answer": "Net zero carbon emission goal by 2038.",
        "context": "ONGC shares gained after the firm announced it will invest around Rs 2 lakh crore to establish renewable energy sites and green hydrogen plants in an attempt to achieve its netzero carbon emission goal by 2038."
    },
    {
        "question": "How much will ONGC invest by 2030 to establish renewable energy capacity?",
        "answer": "Rs 97,000 crore.",
        "context": "Additionally the stateowned firm will invest Rs 97000 crore by 2030 to establish 5 gigawatts of renewable energy capacity green hydrogen biogas a pump storage plant and an offshore wind project."
    },
    {
        "question": "How much did ONGC shares increase by on the NSE at 9.30 am?",
        "answer": "0.7 percent.",
        "context": "At 9.30 am ONGC shares were quoting Rs 299.25 on the NSE higher by 0.7 percent."
    },
    {
        "question": "How much will ONGC invest in green hydrogen or green ammonia plants by 2035?",
        "answer": "Rs 65,500 crore.",
        "context": "The oil and gas firm said it will invest Rs 65500 crore more by 2035 for either a green hydrogen or green ammonia plant and the last Rs 38000 crore by 2038 in creating 1 GW of offshore wind projects."
    },
    {
        "question": "How many million tonnes of carbon emissions will ONGC offset as a result of these projects?",
        "answer": "Around 9 million tonnes.",
        "context": "As a result of these projects ONGC will be able to offset around 9 million tonnes of carbon emissions it is directly or indirectly responsible for."
    },
    {
        "question": "How much will ONGC invest to cut gas flaring to zero by 2030?",
        "answer": "Rs 5,000 crore.",
        "context": "The firm said it will put Rs 5000 crore to cut gas flaring to zero by 2030 through technological intervention."
    },
    {
        "question": "How much methane did ONGC release into the atmosphere in 2021-22?",
        "answer": "554 million cubic meters.",
        "context": "ONGC released 554 million cubic metres of methane in 202122 into the atmosphere mostly because it was an incidental byproduct of oil."
    },
    {
        "question": "What percentage did ONGC shares jump in the trade over the past year?",
        "answer": "More than 80 percent.",
        "context": "Over the past year shares of staterun ONGC jumped more than 80 percent in the trade as against a 26 percent rise in the frontline Nifty 50 index during the same period."
    },
    {
        "question": "What is Jefferies' stance on ONGC's stock, and what is their target price?",
        "answer": "Jefferies has maintained its 'buy' rating on ONGC stock, setting a target price of Rs 390 per share. This represents a potential 50% increase from the current share price.",
        "context": "Despite the recent dip in ONGC's stock price, international brokerage firm Jefferies remains optimistic. They have retained their 'buy' call on the stock, citing the Indian government's consistent policies as a factor that should sustain ONGC's high profitability.  Jefferies believes the recent decline in share price presents a good opportunity for investors and has set a target price of Rs 390 per share, indicating a potential 50% upside from current levels."
    },
    {
        "question": "How has ONGC's stock performed since the recent election results in India?",
        "answer": "ONGC's stock price has dropped by around 9% since the June 4th election results, when the ruling BJP party failed to secure a clear majority.",
        "context": "The outcome of the recent Indian elections has impacted ONGC's stock performance. Since the June 4th announcement that the ruling BJP party did not achieve a simple majority, investors have been selling their ONGC shares, resulting in a roughly 9% decline in the stock's value."
    },
    {
        "question": "What does Jefferies see as the key factors to watch for in ONGC's future performance?",
        "answer": "Jefferies highlights ONGC's production increase in the KG basin during the third quarter of the current fiscal year and its impact on profitability as key indicators to monitor.",
        "context": "Jefferies emphasizes the importance of tracking specific aspects of ONGC's operations for investors.  They believe that the company's efforts to ramp up production in the KG basin during the third quarter of this fiscal year will be crucial. Additionally, how this increase in production translates into profitability will be a key indicator of ONGC's future success."
    },
    {
        "question": "What is the potential risk to ONGC according to Jefferies?",
        "answer": "Jefferies identifies significant fluctuations in crude oil prices \u2013 either a sharp rise or fall \u2013 as potential risks for ONGC's future performance.",
        "context": "While optimistic overall, Jefferies does acknowledge potential challenges for ONGC. They warn that substantial volatility in the price of crude oil, whether a sudden surge or a steep decline, could negatively impact the company's future prospects. "
    },
    {
        "question": "How does Jefferies expect ONGC to perform financially in the coming years?",
        "answer": "Jefferies predicts ONGC will generate substantial free cash flow and reduce its consolidated net debt, resulting in profitable growth from FY24 to FY26.",
        "context": "In a note published on April 15th, Jefferies outlined their positive outlook for ONGC's financial performance. They anticipate the company will generate significant free cash flow over the next few fiscal years (FY24-FY26), enabling ONGC to pay down its consolidated net debt. This strategic financial management is expected to lead to a period of profitable growth for the company."
    },
    {
        "question": "What is Jefferies' opinion on the recent correction in ONGC's stock price?",
        "answer": "Jefferies believes the recent drop in ONGC's stock price is excessive and presents an attractive buying opportunity for investors.",
        "context": "Although ONGC's stock has experienced a downturn, Jefferies views this as an overreaction by the market. They believe the decline is disproportionate to the company's actual performance and potential, making it a good time for investors to consider buying shares at a discounted price."
    },
    {
        "question": "How has ONGC's stock performed compared to the Nifty 50 index in the last year?",
        "answer": "ONGC's stock has outperformed the Nifty 50 index significantly, rising 67% in the past year compared to the index's 25% gain.",
        "context": "ONGC's stock has demonstrated strong performance over the past year, even with the recent dip.  The stock has climbed an impressive 67% during this period, exceeding the broader market's performance, as represented by the Nifty 50 index, which saw a 25% increase."
    },
    {
        "question": "What is the reason behind Jefferies' confidence in ONGC's sustained profitability"
    },
    {
        "question": "What is ONGC seeking help for?",
        "answer": "ONGC is seeking help from an internationally proven technical service provider to raise oil and gas production from its flagship but old and maturing Mumbai field in the Arabian Sea.",
        "context": "Stateowned Oil and Natural Gas Corporation (ONGC) is seeking help from an internationallyproven technical service provider to raise oil and gas production from its flagship but old and maturing Mumbai field in the Arabian Sea."
    },
    {
        "question": "When did the Mumbai High field commence production?",
        "answer": "The giant multilayered Mumbai High field commenced production 48 years ago in 1976.",
        "context": "The giant multilayered Mumbai High field which commenced production 48 years ago in 1976 is currently in its mature stage of production and ONGC has implemented a number of schemes in this field to improve production  it said."
    },
    {
        "question": "What is the current production of the Mumbai High field?",
        "answer": "The field is currently producing 134000 bpd and about 10 million standard cubic metres per day of gas.",
        "context": "While it hit a peak output of 40000 barrels per day in 1989 the field is producing 134000 bpd and about 10 million standard cubic metres per day of gas."
    },
    {
        "question": "What is the estimated balance reserve of the Mumbai High field?",
        "answer": "The field is estimated to hold a balance reserve of 80 million tonnes (610 million barrels) of oil and over 40 billion cubic metres of gas.",
        "context": "The field is estimated to hold a balance reserve of 80 million tonnes (610 million barrels) of oil and over 40 billion cubic metres of gas."
    },
    {
        "question": "What will the service provider be paid?",
        "answer": "The service provider would be paid a fixed fee and a biddable share from the revenue earned from incremental production over an agreed baseline.",
        "context": "The service provider would give technical solutions for raising the output. It will be paid a fixed fee and a biddable share from the revenue earned from incremental production over an agreed baseline."
    },
    {
        "question": "When are the bids due?",
        "answer": "The bids are due in midSeptember.",
        "context": "The firm said adding that the bids are due in midSeptember."
    },
    {
        "question": "What is the scope of work for the service provider?",
        "answer": "The identified service provider would carry out a comprehensive review of field performance and identify improvements in wells reservoirs including water injection and facilities management (WRFM).It would suggest and help implement suitable technological interventions to improve production. Integrated reservoir FEED studies and development of detailed work plans for field development would also be within the scope of work it said.",
        "context": "The identified service provider would carry out a comprehensive review of field performance and identify improvements in wells reservoirs including water injection and facilities management (WRFM).It would suggest and help implement suitable technological interventions to improve production. Integrated reservoir FEED studies and development of detailed work plans for field development would also be within the scope of work it said."
    },
    {
        "question": "What are the requirements for participating in the ICB?",
        "answer": "All international oil and gas majors having annual revenue above USD 75 billion are invited to participate in this ICB.",
        "context": "All international oil and gas majors having annual revenue above USD 75 billion are invited to participate in this ICB."
    },
    {
        "question": "What was ONGC's reported EBITDA in the fourth quarter of fiscal year 2024?",
        "answer": "ONGC's reported EBITDA stood at INR174 billion in the fourth quarter of fiscal year 2024, a 7% increase year-over-year.",
        "context": "Motilal Oswal's research report on ONGC's reported EBITDA stood at INR174b ( 7  YoY) in 4QFY24 3  below our estimate mainly due to higherthanexpected other expenses."
    },
    {
        "question": "What was the primary reason for ONGC's higher-than-expected other expenses in the fourth quarter?",
        "answer": "The sharp rise in other expenses was due to one-off charges of INR9 billion for tax-related matters.",
        "context": "The sharp rise in other expenses was due to oneoff charges of INR9b for taxrelated matters."
    },
    {
        "question": "How much higher was ONGC's fourth-quarter PAT than Motilal Oswal's estimate?",
        "answer": "ONGC's fourth-quarter PAT was 13% higher than Motilal Oswal's estimate.",
        "context": "4Q PAT was 13  higher than our estimate mainly aided by lowerthan expected depreciation and dry well writeoffs."
    },
    {
        "question": "What is ONGC's management's expectation for total production (excluding JVs) in the next three years?",
        "answer": "ONGC management expects total production (excl. JV) to rise to 47 million tonnes of oil equivalent in the next three years, up from 39 million tonnes of oil equivalent currently.",
        "context": "ONGC management expects total production (excl. JV) to rise to 47mmtoe in the next three years from 39mmtoe now mainly driven by KG98 2 and Daman upside development."
    },
    {
        "question": "What is the expected ramp-up rate for gas production from the KG98 2 asset?",
        "answer": "Gas production from the KG98 2 asset is expected to ramp up to 10 million standard cubic meters per day by the end of fiscal year 2025.",
        "context": "Gas production from the KG98 2 asset which will begin in 3QFY25 is expected to ramp up to 10mmscmd by FY25 end while oil production could ramp up to 45000bopd by 4QFY25."
    },
    {
        "question": "What is ONGC's expected capex for fiscal year 2025?",
        "answer": "ONGC expects capex to normalize at INR330-350 billion in fiscal year 2025.",
        "context": "FY24 capex stood at INR370b attributed to oneoff projects and the capitalization of some expenses. ONGC expects capex to normalize at INR330350b in FY25."
    },
    {
        "question": "At what multiple is ONGC currently trading?",
        "answer": "ONGC is currently trading at 2.8x FY26E EV EBITDA (SA) and 7.1x FY26E P E (SA).",
        "context": "OutlookONGC is trading at 2.8x FY26E EV EBITDA (SA) and 7.1x FY26E P E (SA)."
    },
    {
        "question": "What is Motilal Oswal's target price for ONGC?",
        "answer": "Motilal Oswal values ONGC at 7x FY26E adj. EPS of INR34 and adds the value of investments to arrive at a target price of INR340.",
        "context": "We value the company at 7x FY26E adj. EPS of INR34 and add the value of investments to arrive at our TP of INR340."
    },
    {
        "question": "Why did Oil and Gas stocks drop sharply on June 4th?",
        "answer": "Oil and Gas stocks fell due to profit-booking after a significant rally in the previous session.",
        "context": "Oil and Gas stocks bled on June 4 as investors rushed to book profits after the sharp rally in the previous session."
    },
    {
        "question": "Which company's stock dropped the most on June 4th?",
        "answer": "Adani Total Gas's stock fell over 10 percent, leading the losses in the Nifty Oil & Gas index.",
        "context": "The Nifty Oil   Gas index slipped over 5 percent in early trade with losses led by Adani Total Gas which nosedived over 10 percent."
    },
    {
        "question": "What caused the Nifty Oil & Gas index to rise on June 3rd?",
        "answer": "The Nifty Oil & Gas index rose on June 3rd due to exit polls indicating a strong victory for the BJP-led NDA in the Indian elections.",
        "context": "The Nifty Oil   Gas index had risen over 6 percent in the previous session after exit polls hinted at a thumping victory for the BJPled NDA with over 350 seats."
    },
    {
        "question": "How much did Sensex and Nifty 50 drop after early election results showed a less emphatic NDA victory?",
        "answer": "Sensex and Nifty 50 dropped more than 4 percent, eroding nearly Rs 25 lakh crore from BSE market capitalization.",
        "context": "As early leads showed the NDA coalition s majority may not be as emphatic as exit polls had forecast Sensex and Nifty 50 dropped more than 4 percent eroding nearly Rs 25 lakh crore from BSE market capitalisation."
    },
    {
        "question": "What is Deven Choksey's opinion on the market's reaction to the election results?",
        "answer": "Deven Choksey believes that the market is overreacting based on limited election results and that the counting process is slower than usual due to physical counting under VVPAT.",
        "context": "Follow our market blog to catch all the live actionDeven Choksey MD of DRChoksey FinServ believes that the market is reacting with just two rounds of counting done. Also due to physical counting under VVPAT the process is slower this time around."
    },
    {
        "question": "According to Deven Choksey, how is the market likely to behave once the election results are fully known?",
        "answer": "Choksey believes that the market will stabilize and high-beta stocks will continue to be bought.",
        "context": "However he emphasized that longterm investors were unlikely to make hasty decisions in response to the market volatility as the fundamental prospects of the economy and corporate sector remain intact despite the election outcome.According to the Choksey market will once again stabilize and the same high beta stocks will be bought."
    },
    {
        "question": "What is the impact of profit-taking on the share prices of ONGC and Gail India?",
        "answer": "Shares of ONGC and Gail India, along with other PSUs in the sector, fell up to 7 percent due to profit-taking.",
        "context": "Shares of ONGC Gail India and other PSUs in the sector including HPCL Indian Oil and BPCL also fell up to 7 percent on account of profittaking."
    },
    {
        "question": "How did the market respond to the early election results that indicated a less decisive victory for the NDA?",
        "answer": "The market reacted negatively, with Sensex and Nifty 50 dropping more than 4 percent.",
        "context": "As early leads showed the NDA coalition s majority may not be as emphatic as exit polls had forecast Sensex and Nifty 50 dropped more than 4 percent eroding nearly Rs 25 lakh crore from BSE market capitalisation."
    },
    {
        "question": "What is the expected production increase for ONGC in the next three years?",
        "answer": "47 million metric tons of oil equivalent (mmtoe), up from the current 39 mmtoe.",
        "context": "ONGC's management expects total production to rise to 47 million metric ton of oil equivalent (mmtoe) over the next three years up from 39 mmtoe currently."
    },
    {
        "question": "What is the target price set by Motilal Oswal for ONGC?",
        "answer": "Rs 340, implying a 21% potential upside.",
        "context": "Motilal Oswal increased its total production assumptions for FY25 FY26 by 2 percent 3 percent. The brokerage increased its price target to Rs 340 implying 21 percent potential upside and reiterated its buy rating on the stock."
    },
    {
        "question": "What is the target price set by Jefferies for ONGC?",
        "answer": "Rs 390 per share, indicating an upside of nearly 40% from the previous session's closing price.",
        "context": "International brokerage Jefferies kept its buy call on the player steady with a target price of Rs 390 per share. This indicates an upside of nearly 40 percent from the previous session s closing price."
    },
    {
        "question": "What is the reason for ONGC's profit jump, according to Jefferies?",
        "answer": "Lower exploration costs and higher other income.",
        "context": "Jefferies said that ONGC s jump in profit was 14 percent ahead of its expectations as a result of lower exploration costs and higher other income."
    },
    {
        "question": "What is JM Financial's view on ONGC's risk-reward ratio?",
        "answer": "Still reasonable despite the recent rally.",
        "context": "JM Financial also maintained its buy rating with an unchanged price target of Rs 300 per share as riskreward is still reasonable despite the recent rally."
    },
    {
        "question": "How much have ONGC shares increased in the past year?",
        "answer": "Around 70%, compared to a 23% gain in the Nifty 50 index.",
        "context": "Over the past year ONGC shares have surged around 70 percent as compared to a 23 percent gain in the frontline index Nifty 50."
    },
    {
        "question": "What is ONGC's capex expected to be in FY25?",
        "answer": "Rs 33,000-35,000 crore, after a one-off capex of Rs 37,000 crore in FY24.",
        "context": "FY24 capex stood at Rs 37000 crore attributed to oneoff projects and the capitalization of some expenses. ONGC expects capex to normalise at Rs 3300035000 crore in FY25."
    },
    {
        "question": "What is the reason for ONGC's higher revenue in Q4 FY24?",
        "answer": "Marginal increase in revenue from operations.",
        "context": "The stateowned oil and gas exploration major reported marginal increase in revenue from operations for the fourth quarter of FY24 amounting to Rs 1.66 lakh crore."
    },
    {
        "question": "What was ONGC's net sales in March 2024?",
        "answer": "ONGC's net sales in March 2024 were Rs 166770.63 crore.",
        "context": "Net Sales at Rs 166770.63 crore in March 2024 up 1.65  from Rs. 164066.72 crore in March 2023."
    },
    {
        "question": "What was ONGC's quarterly net profit in March 2024?",
        "answer": "ONGC's quarterly net profit in March 2024 was Rs. 10107.36 crore.",
        "context": "Quarterly Net Profit at Rs. 10107.36 crore in March 2024 up 172.03  from Rs. 3715.48 crore in March 2023."
    },
    {
        "question": "What was ONGC's EBITDA in March 2024?",
        "answer": "ONGC's EBITDA in March 2024 was Rs. 26329.83 crore.",
        "context": "EBITDA stands at Rs. 26329.83 crore in March 2024 up 11.29  from Rs. 23658.81 crore in March 2023."
    },
    {
        "question": "What was ONGC's EPS in March 2024?",
        "answer": "ONGC's EPS in March 2024 was Rs. 8.03.",
        "context": "ONGC EPS has increased to Rs. 8.03 in March 2024 from Rs. 2.95 in March 2023."
    },
    {
        "question": "What is the current share price of ONGC?",
        "answer": "ONGC shares closed at 279.00 on May 18 2024 (NSE).",
        "context": "ONGC shares closed at 279.00 on May 18 2024 (NSE) and has given 41.02  returns over the last 6 months and 67.72  over the last 12 months."
    },
    {
        "question": "What were ONGC's returns over the last 6 months?",
        "answer": "ONGC's returns over the last 6 months were 41.02%.",
        "context": "ONGC shares closed at 279.00 on May 18 2024 (NSE) and has given 41.02  returns over the last 6 months and 67.72  over the last 12 months."
    },
    {
        "question": "What were ONGC's returns over the last 12 months?",
        "answer": "ONGC's returns over the last 12 months were 67.72%.",
        "context": "ONGC shares closed at 279.00 on May 18 2024 (NSE) and has given 41.02  returns over the last 6 months and 67.72  over the last 12 months."
    },
    {
        "question": "What is the context of the given information?",
        "answer": "The given information is about ONGC's financial performance in March 2024.",
        "context": "Net Sales at Rs 166770.63 crore in March 2024 up 1.65  from Rs. 164066.72 crore in March 2023.Quarterly Net Profit at Rs. 10107.36 crore in March 2024 up 172.03  from Rs. 3715.48 crore in March 2023.EBITDA stands at Rs. 26329.83 crore in March 2024 up 11.29  from Rs. 23658.81 crore in March 2023.ONGC EPS has increased to Rs. 8.03 in March 2024 from Rs. 2.95 in March 2023.ONGC shares closed at 279.00 on May 18 2024 (NSE) and has given 41.02  returns over the last 6 months and 67.72  over the last 12 months."
    },
    {
        "question": "How much was ONGC's consolidated net profit in Q4 of FY23-24?",
        "answer": "Rs 11526.53 crore",
        "context": "Oil and Natural Gas Corporation (ONGC) posted an increase of around 78 percent in consolidated net profit at Rs 11526.53 crore in the fourth quarter of the financial year 2023-24 compared to Rs 6478.23 crore in the same period last year."
    },
    {
        "question": "How did ONGC's consolidated net profit compare to the previous quarter?",
        "answer": "Marginally increased",
        "context": "Sequentially, ONGC's consolidated net profit increased marginally in the quarter ended March 31 from Rs 11104.50 crore posted in the previous quarter."
    },
    {
        "question": "What was ONGC's revenue from operations in Q4 of FY23-24?",
        "answer": "Rs 1.66 lakh crore",
        "context": "The state-owned oil and gas exploration major reported a marginal increase in revenue from operations for the fourth quarter of the current fiscal year, amounting to Rs 1.66 lakh crore compared to Rs 1.64 lakh crore recorded in the same period of the previous year."
    },
    {
        "question": "What dividend per share did ONGC's board of directors recommend?",
        "answer": "Rs 2.50 per share",
        "context": "The company's board of directors recommended a final dividend of Rs 2.50 per equity share of face value of Rs 5 each for the financial year 2023-24, subject to the approval of shareholders."
    },
    {
        "question": "How did ONGC's EBITDA perform in Q4 of FY23-24?",
        "answer": "Increased to Rs 25772 crore",
        "context": "ONGC's earnings before interest, tax, depreciation, and amortization (EBITDA) for Q4 rose to Rs 25772 crore from Rs 15752 crore during the corresponding period last year."
    },
    {
        "question": "What was the average analyst estimate for ONGC's net profit in Q4 of FY23-24?",
        "answer": "Rs 8434 crore",
        "context": "According to the average of eight analysts' estimates surveyed by, the upstream oil company's net profit was seen falling over 11 percent year-on-year to Rs 8434 crore."
    },
    {
        "question": "How did ONGC's crude oil production perform in Q4 of FY23-24?",
        "answer": "Increased by 2.4 percent",
        "context": "In the fourth quarter, the company's total crude oil production increased 2.4 percent from last year at 5.359 million metric tonnes (MMT)."
    },
    {
        "question": "How many exploratory and development wells did ONGC drill in FY23-24?",
        "answer": "541 wells, including 103 exploratory and 438 development wells",
        "context": "ONGC drilled 541 wells, the highest recorded in the past 34 years, comprising 103 exploratory and 438 development wells."
    },
    {
        "question": "What is the estimated net profit of ONGC for the quarter ended March 2024?",
        "answer": "Rs 8434 crore",
        "context": "The upstream oil company's net profit is seen falling over 11 percent year-on-year to Rs 8434 crore according to the average of 8 analysts estimates surveyed by."
    },
    {
        "question": "What factors are expected to contribute to the decline in ONGC's net profit?",
        "answer": "Lower oil and gas production and a lower administered price mechanism for gas.",
        "context": "The decline in profit after tax (PAT) is expected to be on account of lower oil and gas production and a lower administered price mechanism for gas."
    },
    {
        "question": "By how much is ONGC's revenue expected to decline in Q4FY24?",
        "answer": "1.11 percent",
        "context": "The company's Q4 revenue is expected to decline marginally by 1.11 percent to Rs 34404 crore."
    },
    {
        "question": "What is the reason for the expected decline in ONGC's EBITDA in Q4FY24?",
        "answer": "Lower administered price mechanism (APM) gas price and lower oil and gas production",
        "context": "Meanwhile EBITDA is seen falling half a percent YoY to Rs 17251 crore on lower administered price mechanism (APM) gas price and lower oil and gas production by ONGC but partially offset by higher crude oil realisation."
    },
    {
        "question": "What is the expected change in ONGC's oil sales volume in Q4FY24?",
        "answer": "4 percent increase",
        "context": "Oil sales volumes are seen rising 4 percent on-year but gas sales volumes are expected to decline 2 percent YoY."
    },
    {
        "question": "How is Kotak Institutional Equities expecting ONGC's EBITDA to grow in Q4FY24?",
        "answer": "35 percent QoQ",
        "context": "With both oil and gas prices capped and volumes largely flat Kotak Institutional Equities expects a modest 35 percent QoQ EBITDA growth for upstream firms like ONGC led by lower operating expenses (Opex)."
    },
    {
        "question": "Why is ONGC's PAT likely to decline on a sequential basis in Q4FY24?",
        "answer": "Higher writeoffs and survey expenses",
        "context": "The PSU's PAT is likely to decline 14 percent on a sequential basis as well due to likely higher writeoffs and survey expenses in the fiscal fourth quarter the brokerage said."
    },
    {
        "question": "What is the expected change in ONGC's net crude and gas realization in Q4FY24?",
        "answer": "Flattish sequentially",
        "context": "JM Financial expects ONGC's Q4FY24 net crude and gas realization to be largely flattish sequentially. Sales volume is also expected to be flat to slightly lower on a quarter-on-quarter (QoQ) basis."
    },
    {
        "question": "Who is reportedly in talks to form a consortium to bid for Ayana Renewable Power?",
        "answer": "ONGC and NTPC Green Energy are reportedly in talks to form a consortium to bid for Ayana Renewable Power.",
        "context": "Oil and Natural Gas Corporation (ONGC) and NTPC Green Energy are reportedly in talks to form a consortium to bid for Ayana Renewable Power which is owned by the National Investment and Infrastructure Fund (NIIF) as interest grows in acquiring the Bengalurubased firm."
    },
    {
        "question": "Who is the owner of Ayana Renewable Power?",
        "answer": "The National Investment and Infrastructure Fund (NIIF) is the owner of Ayana Renewable Power.",
        "context": "Ayana Renewable Power is owned by the National Investment and Infrastructure Fund (NIIF) as interest grows in acquiring the Bengalurubased firm."
    },
    {
        "question": "Who else is in the running to acquire Ayana Renewable?",
        "answer": "JSW Neo Energy, Sekura Energy, Masdar, Macquarie, and Sembcorp are also in the running to acquire Ayana Renewable.",
        "context": "JSW Neo Energy Sekura Energy Masdar Macquarie and Sembcorp are also in the running to acquire Ayana Renewable."
    },
    {
        "question": "What is the expected timeline for the bidding process?",
        "answer": "NIIF is expected to shortlist bidders in the coming weeks, allowing them to conduct due diligence before submitting binding financial proposals.",
        "context": "NIIF is expected to shortlist bidders in the coming weeks allowing them to conduct due diligence before submitting binding financial proposals."
    },
    {
        "question": "What is the name of the subsidiary that ONGC launched earlier this year?",
        "answer": "ONGC Green is the name of the subsidiary that ONGC launched earlier this year.",
        "context": "Earlier this year, ONGC launched ONGC Green, a subsidiary dedicated to renewable energy projects, while NTPC Green Energy has plans for an initial public offering."
    },
    {
        "question": "What are NTPC Green Energy's plans for an initial public offering?",
        "answer": "NTPC Green Energy has plans for an initial public offering.",
        "context": "Earlier this year, ONGC launched ONGC Green, a subsidiary dedicated to renewable energy projects, while NTPC Green Energy has plans for an initial public offering."
    },
    {
        "question": "What type of projects does Ayana Renewable Power have in its pipeline?",
        "answer": "Ayana Renewable Power boasts a substantial pipeline of over 4 GW of solar, wind, and hybrid power projects across multiple states.",
        "context": "Ayana Renewable Power boasts a substantial pipeline of over 4 GW of solar wind and hybrid power projects across multiple states."
    },
    {
        "question": "What is Ayana Renewable Power's operational capacity?",
        "answer": "Ayana Renewable Power has an operational capacity of 1.3 GW in Andhra Pradesh, Karnataka, and Rajasthan.",
        "context": "With an operational capacity of 1.3 GW in Andhra Pradesh Karnataka and Rajasthan Ayana is a significant player in the renewable energy sector."
    },
    {
        "question": "What did Morgan Stanley issue on the PSU stock of Oil and Natural Gas Corporation (ONGC)?",
        "answer": "Morgan Stanley issued an overweight call on the PSU stock of Oil and Natural Gas Corporation (ONGC).",
        "context": "Shares of Oil and Natural Gas Corporation (ONGC) gained on April 18 as Morgan Stanley has issued an overweight call on the PSU stock with a target of Rs 304 per share."
    },
    {
        "question": "What is the target price set by Morgan Stanley for ONGC?",
        "answer": "The target price set by Morgan Stanley for ONGC is Rs 304 per share.",
        "context": "Shares of Oil and Natural Gas Corporation (ONGC) gained on April 18 as Morgan Stanley has issued an overweight call on the PSU stock with a target of Rs 304 per share."
    },
    {
        "question": "What is expected to support a steady 18-20 percent return on equity (RoE) for ONGC?",
        "answer": "Stable regulations are anticipated to support a steady 18-20 percent return on equity (RoE) for ONGC.",
        "context": "Additionally stable regulations are anticipated to support a steady 1820 percent return on equity (RoE)."
    },
    {
        "question": "Why has the ONGC stock gained over 5 percent in the last five trading sessions?",
        "answer": "The ONGC stock has gained over 5 percent in the last five trading sessions due to a surge in crude oil prices amid rising hostilities between Israel and Iran.",
        "context": "The ONGC stock has gained over 5 percent in the last five trading sessions due to a surge in crude oil prices amid rising hostilities between Israel and Iran."
    },
    {
        "question": "What is the potential upside from the previous close as per Jefferies' target price for ONGC?",
        "answer": "The potential upside from the previous close as per Jefferies' target price for ONGC is 37 percent.",
        "context": "Jefferies also recently initiated coverage on ONGC with a buy rating driven by favourable crude and gas reforms as well as improved profitability. The brokerage has set a target price of Rs 390 apiece implying a potential upside of 37 percent from the previous close."
    },
    {
        "question": "How does Jefferies expect ONGC to benefit from the tight crude oil market?",
        "answer": "Jefferies expects ONGC to gain from a tight crude oil market as the IEA (International Energy Agency) anticipates a supply deficit of 1.5 million barrels per day in 2023.",
        "context": "According to Jefferies analysts ONGC stands to gain from a tight crude oil market as the IEA (International Energy Agency)."
    },
    {
        "question": "How has the government's pragmatism allowed ONGC to increase its net realization?",
        "answer": "The government's pragmatism has allowed ONGC to increase its net realization to $75 even in the face of industry underrecoveries.",
        "context": "The government s pragmatism has also allowed it to increase ONGC net realization to  75 even in the face of industry underrecoveries."
    },
    {
        "question": "What is expected to add to earnings for ONGC, according to Jefferies?",
        "answer": "Reforms to gas pricing are expected to add to earnings for ONGC, according to Jefferies.",
        "context": "Reforms to gas pricing are expected to add to earnings for ONGC Jefferies added."
    },
    {
        "question": "What is the current trading price of ONGC shares?",
        "answer": "Rs 275 per share",
        "context": "ONGC shares are up by 3.63  percent trading at Rs 275 per share."
    },
    {
        "question": "How much have ONGC shares contributed to the recovery of the BSE Oil & Gas index?",
        "answer": "200 points",
        "context": "ONGC shares alone are seen contributing to 200 points to recovery of BSE Oil   Gas index."
    },
    {
        "question": "What is the target price for ONGC shares according to Jefferies?",
        "answer": "Rs 390 per share",
        "context": "ONGC shares are rallying after Jefferies initiated a  buy  call with Rs 390 per share target price."
    },
    {
        "question": "Why does Jefferies believe that ONGC shares are undervalued?",
        "answer": "They are trading at a steeper discount to the benchmark Nifty compared to their long-term average.",
        "context": "According to Jefferies the ONGC shares are trading at a steeper discount to the benchmark Nifty compared to its longterm average."
    },
    {
        "question": "Which other companies are contributing to the recovery of the BSE Oil & Gas index?",
        "answer": "IGL, GAIL, Linde India, and Petronet LNG",
        "context": "The index is seen recovering by more than 1000 points from day s low. The index made a low of 27339 and is trading near 28400 levels  staging a recovery lead by IGL ONGC GAIL Linde India and Petronet LNG."
    },
    {
        "question": "How has the BSE Oil & Gas index performed compared to the BSE Sensex in the past six months?",
        "answer": "The BSE Oil & Gas index has outperformed the BSE Sensex by 55% to 15%.",
        "context": "Since November 2023 BSE Oil   Gas rose by 55 percent while BSE Sensex has gained by 15 percent."
    },
    {
        "question": "What is the current status of the BSE Sensex as of 10.45 am on April 15th?",
        "answer": "Down by 500 points",
        "context": "ONGC shares are seen rallying on bourses on April 15 a weak market day where BSE Sensex is down by 500 points at 10.45 am."
    },
    {
        "question": "What is the name of the consultancy firm that believes ONGC is near its 2014 multiyear breakout?",
        "answer": "Rupic consultancy",
        "context": "Darpan Patil of Rupic consultancy believes that ONGC is near its 2014 multiyear breakout."
    }
]